{
  "algorithm": {
    "name": "aerost-deterministic-mutation-aware-greedy-multicover",
    "selection": "maximum remaining obligation-and-mutation-slot gain",
    "tie_breaking": [
      "maximum mutation gain",
      "maximum obligation gain",
      "minimum cycle count",
      "lexicographically smallest scenario id"
    ],
    "version": "0.1.0"
  },
  "claim_boundary": {
    "global_minimum_claimed": false,
    "mutation_profile_driven": true,
    "mutation_scope": "8 application-profile-controlled non-equivalent AIR mutants",
    "operators": {
      "MUT-CRITICAL-CONDITION": "critical-condition",
      "MUT-CRITICAL-OUTPUT-DELETE": "critical-output-delete",
      "MUT-CRITICAL-TARGET": "critical-target",
      "MUT-DUAL-SOURCE-OPERATOR": "dual-source-operator",
      "MUT-INVALID-OUTPUT-GUARD": "invalid-output-guard",
      "MUT-PAYLOAD-DEFAULT": "payload-default",
      "MUT-SWAP-ISOLATION": "swap-isolation",
      "MUT-WEAKEN-RECOVERY": "weaken-recovery"
    }
  },
  "deterministic": true,
  "input_summary": {
    "controlled_mutants": 8,
    "cycles": 773,
    "obligations": 327,
    "required_obligation_witness_slots": 333,
    "scenarios": 333,
    "total_required_slots": 341
  },
  "mcdc_summary": {
    "obligations": 6,
    "required_witnesses_per_obligation": 2,
    "witness_counts": {
      "OBL-MCDC-AIR-DEC-8C1AAF3C5949-AIR-COND-14A07CAD6C04": 2,
      "OBL-MCDC-AIR-DEC-8C1AAF3C5949-AIR-COND-63B49803733D": 2,
      "OBL-MCDC-AIR-DEC-A2A44279A13D-AIR-COND-46486C3E7B4D": 2,
      "OBL-MCDC-AIR-DEC-A2A44279A13D-AIR-COND-933AFAC55E2F": 2,
      "OBL-MCDC-AIR-DEC-A2A44279A13D-AIR-COND-B1E7AF6F9325": 2,
      "OBL-MCDC-AIR-DEC-A2A44279A13D-AIR-COND-D765DACDD027": 2
    }
  },
  "mutation_summary": {
    "killed": 8,
    "score_percent": 100.0,
    "selected_detection_cases": {
      "MUT-CRITICAL-CONDITION": [
        {
          "cycle": 1,
          "scenario_id": "SYN-0C365CC489A9"
        },
        {
          "cycle": 1,
          "scenario_id": "SYN-0C4D76DABD7D"
        },
        {
          "cycle": 1,
          "scenario_id": "SYN-0E2ECCCF9903"
        },
        {
          "cycle": 1,
          "scenario_id": "SYN-0F047A7CA9E0"
        },
        {
          "cycle": 1,
          "scenario_id": "SYN-13886C225834"
        },
        {
          "cycle": 1,
          "scenario_id": "SYN-1F8ED227BA87"
        },
        {
          "cycle": 1,
          "scenario_id": "SYN-244BE428F182"
        },
        {
          "cycle": 1,
          "scenario_id": "SYN-24F720B8BE86"
        },
        {
          "cycle": 1,
          "scenario_id": "SYN-26CED2847590"
        },
        {
          "cycle": 1,
          "scenario_id": "SYN-2D29D79B7A2B"
        },
        {
          "cycle": 1,
          "scenario_id": "SYN-373151231CD9"
        },
        {
          "cycle": 1,
          "scenario_id": "SYN-4E02B97273C3"
        },
        {
          "cycle": 1,
          "scenario_id": "SYN-5469BB47BDD9"
        },
        {
          "cycle": 1,
          "scenario_id": "SYN-5B31D4D86864"
        },
        {
          "cycle": 1,
          "scenario_id": "SYN-75238302328D"
        },
        {
          "cycle": 1,
          "scenario_id": "SYN-7A019ED87C6B"
        },
        {
          "cycle": 1,
          "scenario_id": "SYN-7E944758FC88"
        },
        {
          "cycle": 1,
          "scenario_id": "SYN-8CABF7DD6305"
        },
        {
          "cycle": 1,
          "scenario_id": "SYN-9A7FF2A60357-B"
        },
        {
          "cycle": 1,
          "scenario_id": "SYN-B4897F0CB05A"
        },
        {
          "cycle": 1,
          "scenario_id": "SYN-C6BA600A601E-B"
        },
        {
          "cycle": 1,
          "scenario_id": "SYN-CB45FE850445"
        },
        {
          "cycle": 1,
          "scenario_id": "SYN-D9E709D59A16"
        },
        {
          "cycle": 1,
          "scenario_id": "SYN-EF088AB10A6F"
        }
      ],
      "MUT-CRITICAL-OUTPUT-DELETE": [
        {
          "cycle": 0,
          "scenario_id": "SYN-0003E9E484D2"
        },
        {
          "cycle": 1,
          "scenario_id": "SYN-00FA109B760D"
        },
        {
          "cycle": 1,
          "scenario_id": "SYN-0C9DFCFDACDB"
        },
        {
          "cycle": 2,
          "scenario_id": "SYN-0E2ECCCF9903"
        },
        {
          "cycle": 2,
          "scenario_id": "SYN-0F047A7CA9E0"
        },
        {
          "cycle": 0,
          "scenario_id": "SYN-0FFF0F64DF07"
        },
        {
          "cycle": 0,
          "scenario_id": "SYN-1321A07D7DFC"
        },
        {
          "cycle": 2,
          "scenario_id": "SYN-13886C225834"
        },
        {
          "cycle": 1,
          "scenario_id": "SYN-1F2698D2FA4B"
        },
        {
          "cycle": 1,
          "scenario_id": "SYN-20D0F32CA111"
        },
        {
          "cycle": 2,
          "scenario_id": "SYN-244BE428F182"
        },
        {
          "cycle": 1,
          "scenario_id": "SYN-245A3ED2CB0E"
        },
        {
          "cycle": 1,
          "scenario_id": "SYN-247575E69D0B"
        },
        {
          "cycle": 1,
          "scenario_id": "SYN-2579DA4A25D6"
        },
        {
          "cycle": 2,
          "scenario_id": "SYN-26CED2847590"
        },
        {
          "cycle": 1,
          "scenario_id": "SYN-319C578185C7-A"
        },
        {
          "cycle": 1,
          "scenario_id": "SYN-34CFCBE968B2"
        },
        {
          "cycle": 1,
          "scenario_id": "SYN-373151231CD9"
        },
        {
          "cycle": 0,
          "scenario_id": "SYN-3CAA6A6002B2"
        },
        {
          "cycle": 0,
          "scenario_id": "SYN-3D0203E37376-A"
        },
        {
          "cycle": 1,
          "scenario_id": "SYN-3DDACA4879A7"
        },
        {
          "cycle": 1,
          "scenario_id": "SYN-526C6C9D9471"
        },
        {
          "cycle": 0,
          "scenario_id": "SYN-537FAE95F2EE"
        },
        {
          "cycle": 1,
          "scenario_id": "SYN-63DF634F15D4"
        },
        {
          "cycle": 0,
          "scenario_id": "SYN-6C7059696D41-A"
        },
        {
          "cycle": 1,
          "scenario_id": "SYN-6ED048416B27"
        },
        {
          "cycle": 2,
          "scenario_id": "SYN-7A019ED87C6B"
        },
        {
          "cycle": 2,
          "scenario_id": "SYN-8CABF7DD6305"
        },
        {
          "cycle": 0,
          "scenario_id": "SYN-96066F95DAC0-A"
        },
        {
          "cycle": 1,
          "scenario_id": "SYN-BB0425B82ADB"
        },
        {
          "cycle": 1,
          "scenario_id": "SYN-CD6B3E1F07FA"
        },
        {
          "cycle": 0,
          "scenario_id": "SYN-DE669046EC72"
        },
        {
          "cycle": 1,
          "scenario_id": "SYN-E77D32BEF7D9-A"
        },
        {
          "cycle": 1,
          "scenario_id": "SYN-F79E6A709609"
        }
      ],
      "MUT-CRITICAL-TARGET": [
        {
          "cycle": 1,
          "scenario_id": "SYN-373151231CD9"
        }
      ],
      "MUT-DUAL-SOURCE-OPERATOR": [
        {
          "cycle": 1,
          "scenario_id": "SYN-0C365CC489A9"
        },
        {
          "cycle": 1,
          "scenario_id": "SYN-0C4D76DABD7D"
        },
        {
          "cycle": 1,
          "scenario_id": "SYN-0E2ECCCF9903"
        },
        {
          "cycle": 1,
          "scenario_id": "SYN-0F047A7CA9E0"
        },
        {
          "cycle": 1,
          "scenario_id": "SYN-13886C225834"
        },
        {
          "cycle": 1,
          "scenario_id": "SYN-244BE428F182"
        },
        {
          "cycle": 1,
          "scenario_id": "SYN-24F720B8BE86"
        },
        {
          "cycle": 1,
          "scenario_id": "SYN-26CED2847590"
        },
        {
          "cycle": 1,
          "scenario_id": "SYN-2D29D79B7A2B"
        },
        {
          "cycle": 1,
          "scenario_id": "SYN-373151231CD9"
        },
        {
          "cycle": 1,
          "scenario_id": "SYN-4E02B97273C3"
        },
        {
          "cycle": 1,
          "scenario_id": "SYN-5469BB47BDD9"
        },
        {
          "cycle": 1,
          "scenario_id": "SYN-75238302328D"
        },
        {
          "cycle": 1,
          "scenario_id": "SYN-7A019ED87C6B"
        },
        {
          "cycle": 1,
          "scenario_id": "SYN-7E944758FC88"
        },
        {
          "cycle": 1,
          "scenario_id": "SYN-8CABF7DD6305"
        },
        {
          "cycle": 1,
          "scenario_id": "SYN-9A7FF2A60357-B"
        },
        {
          "cycle": 1,
          "scenario_id": "SYN-B4897F0CB05A"
        },
        {
          "cycle": 1,
          "scenario_id": "SYN-C6BA600A601E-B"
        },
        {
          "cycle": 1,
          "scenario_id": "SYN-CB45FE850445"
        },
        {
          "cycle": 1,
          "scenario_id": "SYN-D9E709D59A16"
        },
        {
          "cycle": 1,
          "scenario_id": "SYN-EF088AB10A6F"
        }
      ],
      "MUT-INVALID-OUTPUT-GUARD": [
        {
          "cycle": 0,
          "scenario_id": "SYN-1BAF28554C82"
        }
      ],
      "MUT-PAYLOAD-DEFAULT": [
        {
          "cycle": 0,
          "scenario_id": "SYN-0003E9E484D2"
        },
        {
          "cycle": 1,
          "scenario_id": "SYN-00FA109B760D"
        },
        {
          "cycle": 1,
          "scenario_id": "SYN-0C365CC489A9"
        },
        {
          "cycle": 1,
          "scenario_id": "SYN-0C4D76DABD7D"
        },
        {
          "cycle": 1,
          "scenario_id": "SYN-0C9DFCFDACDB"
        },
        {
          "cycle": 1,
          "scenario_id": "SYN-0E2ECCCF9903"
        },
        {
          "cycle": 1,
          "scenario_id": "SYN-0F047A7CA9E0"
        },
        {
          "cycle": 0,
          "scenario_id": "SYN-0FFF0F64DF07"
        },
        {
          "cycle": 0,
          "scenario_id": "SYN-1321A07D7DFC"
        },